{
  "$schema": "http://json-schema.org/draft-07/schema#",
  "title": "ERD Studio domain",
  "description": "A domain diagram: .erd-studio/{layer}/{domain}.json. References models by name and holds relationships and canvas layout. Reference: https://github.com/liam-machine/erd-studio/blob/main/docs/semantic-domain-json-reference.md#domain-file-erd-studiolayerdomainjson",
  "type": "object",
  "required": [
    "schemaVersion",
    "domain",
    "layer",
    "logical"
  ],
  "additionalProperties": false,
  "properties": {
    "$schema": {
      "type": "string",
      "description": "Optional schema reference for editors outside VS Code. Ignored by ERD Studio."
    },
    "schemaVersion": {
      "type": "integer",
      "enum": [
        5,
        4
      ],
      "description": "Domain file format version. Write 5. Version 4 (inline model objects) still loads until migrated with \"ERD Studio: Migrate Domains to Central Model Store\"."
    },
    "domain": {
      "type": "string",
      "minLength": 1,
      "description": "Domain slug. Should equal the file name without .json."
    },
    "layer": {
      "type": "string",
      "minLength": 1,
      "description": "Must match an id in layers.json and the parent directory name."
    },
    "description": {
      "type": "string",
      "description": "Human-readable domain description."
    },
    "modelFolder": {
      "type": "string",
      "description": "Path prefix filter for the \"Add Existing Model\" dialog, e.g. models/silver."
    },
    "stubColumns": {
      "type": "array",
      "description": "Models (typically conformed dimensions / reference tables) that define only key columns. Missing-column discrepancies for them are hidden in Compare.",
      "items": {
        "type": "string"
      },
      "uniqueItems": true
    },
    "logical": {
      "type": "object",
      "description": "The editable logical stage.",
      "required": [
        "models",
        "relationships"
      ],
      "additionalProperties": false,
      "properties": {
        "models": {
          "type": "array",
          "description": "Model NAME strings. Each resolves to .erd-studio/logical-models/{name}.yml or .erd-studio/logical-models/{folder}/{name}.yml. Never mix names with inline model objects — such a file does not open.",
          "oneOf": [
            {
              "items": {
                "type": "string",
                "minLength": 1
              }
            },
            {
              "items": {
                "type": "object",
                "required": [
                  "name"
                ],
                "description": "Deprecated version 4 inline model. Run \"ERD Studio: Migrate Domains to Central Model Store\"."
              },
              "minItems": 1
            }
          ]
        },
        "relationships": {
          "type": "array",
          "description": "FK relationships drawn by this domain. The same two model.column ends — either way round, ignoring case — at most once per domain file; a relationship the model library already holds is not repeated here.",
          "items": {
            "$ref": "#/definitions/relationship"
          }
        },
        "viewConfig": {
          "description": "Deprecated location — viewConfig belongs at the root of the document.",
          "allOf": [
            {
              "$ref": "#/definitions/viewConfig"
            }
          ]
        }
      }
    },
    "viewConfig": {
      "description": "Canvas layout, at the root of the document. Write {} for a new domain — models without a position are placed automatically.",
      "allOf": [
        {
          "$ref": "#/definitions/viewConfig"
        }
      ]
    }
  },
  "if": {
    "properties": {
      "schemaVersion": {
        "const": 5
      }
    },
    "required": [
      "schemaVersion"
    ]
  },
  "then": {
    "properties": {
      "logical": {
        "properties": {
          "models": {
            "items": {
              "type": "string"
            }
          }
        }
      }
    }
  },
  "definitions": {
    "relationship": {
      "type": "object",
      "required": [
        "fromModel",
        "fromColumn",
        "toModel",
        "toColumn",
        "cardinality"
      ],
      "additionalProperties": false,
      "properties": {
        "fromModel": {
          "type": "string",
          "minLength": 1,
          "description": "Model holding the FK (the \"many\" side of many-to-one). A relationship is its two model.column ends, either way round and ignoring case: store each one once."
        },
        "fromColumn": {
          "type": "string",
          "minLength": 1,
          "description": "FK column on fromModel."
        },
        "toModel": {
          "type": "string",
          "minLength": 1,
          "description": "Referenced model (PK side)."
        },
        "toColumn": {
          "type": "string",
          "minLength": 1,
          "description": "Referenced PK column on toModel."
        },
        "cardinality": {
          "type": "string",
          "description": "Relationship cardinality, read from fromModel to toModel. Write many-to-one, one-to-one or many-to-many: a one-to-many is the same relationship stored the other way round, as many-to-one from the other model (still read, but `erd-studio check` reports it in a model file as REL002). A one-to-one runs from the model holding the foreign key. Always write it: an entry without it is drawn as many-to-one (and reported as REL008, in a model file or a domain file alike).",
          "enum": [
            "many-to-one",
            "one-to-one",
            "one-to-many",
            "many-to-many"
          ]
        },
        "role": {
          "type": "string",
          "minLength": 1,
          "maxLength": 60,
          "description": "Optional label for what this link means, e.g. \"order date\" and \"ship date\" for two columns pointing at the same date dimension. A label only; it is not part of the relationship's identity."
        }
      }
    },
    "viewConfig": {
      "type": "object",
      "description": "Canvas layout. Safe to leave as {} — models without a position are placed automatically.",
      "additionalProperties": false,
      "properties": {
        "showFkEdges": {
          "type": "boolean",
          "description": "Whether FK edges are drawn."
        },
        "layoutOptions": {
          "type": "object",
          "description": "ELK layout options as string key/value pairs, e.g. \"elk.direction\": \"DOWN\".",
          "additionalProperties": {
            "type": "string"
          }
        },
        "positions": {
          "type": "object",
          "description": "Node positions keyed by model name. Preserve existing entries when adding models.",
          "additionalProperties": {
            "$ref": "#/definitions/position"
          }
        },
        "annotations": {
          "type": "array",
          "description": "Canvas post-it notes.",
          "items": {
            "$ref": "#/definitions/annotation"
          }
        }
      }
    },
    "position": {
      "type": "object",
      "required": [
        "x",
        "y"
      ],
      "additionalProperties": false,
      "properties": {
        "x": {
          "type": "number"
        },
        "y": {
          "type": "number"
        }
      }
    },
    "annotation": {
      "type": "object",
      "required": [
        "id",
        "text",
        "x",
        "y"
      ],
      "additionalProperties": false,
      "properties": {
        "id": {
          "type": "string",
          "minLength": 1,
          "description": "Unique note id."
        },
        "text": {
          "type": "string",
          "description": "Note text."
        },
        "x": {
          "type": "number"
        },
        "y": {
          "type": "number"
        },
        "width": {
          "type": "number"
        },
        "height": {
          "type": "number"
        },
        "color": {
          "type": "string",
          "description": "Note colour.",
          "enum": [
            "yellow",
            "blue",
            "green",
            "pink",
            "orange"
          ]
        },
        "linkedModel": {
          "type": "string",
          "description": "Draws a dashed edge from the note to this model."
        }
      }
    }
  }
}
