{
  "schemaVersion": 5,
  "domain": "orders",
  "layer": "gold",
  "description": "Orders star",
  "logical": {
    "models": [
      "dim_customer",
      "fct_order",
      "dim_date"
    ],
    "relationships": [
      {
        "fromModel": "fct_order",
        "fromColumn": "customer_key",
        "toModel": "dim_customer",
        "toColumn": "customer_key",
        "cardinality": "many-to-one"
      }
    ]
  },
  "viewConfig": {
    "positions": {
      "dim_customer": {
        "x": 0,
        "y": 260
      },
      "fct_order": {
        "x": 420,
        "y": 260
      },
      "dim_date": {
        "x": 840,
        "y": 260
      }
    }
  }
}
