{
  "schemaVersion": 4,
  "domain": "showcase",
  "layer": "silver",
  "description": "Showcase domain for developer testing — has data across both stages with deliberate discrepancies",
  "modelFolder": "models/silver",
  "logical": {
    "models": [
      {
        "name": "dim_project",
        "schema": "silver",
        "description": "Project dimension table",
        "grain": "One row per project",
        "modelRole": "conformed-dim",
        "rationale": {
          "purpose": "Central project reference shared across domains",
          "design": "Conformed dimension for consistent project attributes",
          "grainChoice": "Natural grain — each project is uniquely identified"
        },
        "columns": [
          {
            "name": "project_id",
            "dataType": "INT",
            "description": "Surrogate key for project",
            "isPrimaryKey": true
          },
          {
            "name": "project_name",
            "dataType": "VARCHAR",
            "description": "Project name"
          },
          {
            "name": "project_code",
            "dataType": "VARCHAR",
            "description": "Business project code — extra column not in physical (discrepancy)"
          },
          {
            "name": "region",
            "dataType": "VARCHAR",
            "description": "Geographic region — extra column not in physical",
            "isNaturalKey": true
          }
        ]
      },
      {
        "name": "dim_work_lot",
        "schema": "silver",
        "description": "Work lot dimension table",
        "grain": "One row per work lot",
        "modelRole": "domain-dim",
        "rationale": {
          "purpose": "Tracks individual work packages and their lifecycle",
          "design": "SCD Type 2 on status to track historical state changes",
          "scdStrategy": "Status changes tracked via SCD2; name is Type 1 overwrite"
        },
        "columns": [
          {
            "name": "work_lot_id",
            "dataType": "INT",
            "description": "Surrogate key for work lot",
            "isPrimaryKey": true
          },
          {
            "name": "project_id",
            "dataType": "INT",
            "description": "FK to dim_project",
            "isForeignKey": true
          },
          {
            "name": "name",
            "dataType": "VARCHAR",
            "description": "Work lot name",
            "scdType": 1
          },
          {
            "name": "status",
            "dataType": "STRING",
            "description": "Current status — type mismatch vs physical (STRING vs VARCHAR)",
            "scdType": 2
          },
          {
            "name": "priority",
            "dataType": "INT",
            "description": "Work lot priority level — extra column not in physical"
          }
        ]
      },
      {
        "name": "dim_location",
        "schema": "silver",
        "description": "Location dimension — exists only in logical (missing from conceptual and physical)",
        "grain": "One row per location",
        "modelRole": "domain-dim",
        "columns": [
          {
            "name": "location_idn",
            "dataType": "INT",
            "description": "Location surrogate key",
            "isPrimaryKey": true
          },
          {
            "name": "site_name",
            "dataType": "VARCHAR",
            "description": "Construction site name",
            "isNaturalKey": true
          },
          {
            "name": "latitude",
            "dataType": "JSON",
            "description": "GPS latitude"
          },
          {
            "name": "longitude",
            "dataType": "FLOAT",
            "description": "GPS longitude"
          }
        ],
        "rationale": {
          "purpose": "k"
        }
      },
      {
        "name": "fct_sale",
        "description": "",
        "columns": [
          {
            "name": "sale_id",
            "dataType": "INTEGER",
            "description": "Surrogate key",
            "isPrimaryKey": true
          },
          {
            "name": "event_date",
            "dataType": "DATE",
            "description": "Business event date"
          },
          {
            "name": "amount",
            "dataType": "DECIMAL(18,2)",
            "description": "Monetary amount"
          },
          {
            "name": "dwh_inserted_at",
            "dataType": "TIMESTAMP_NTZ",
            "description": "Warehouse insert timestamp"
          },
          {
            "name": "dwh_updated_at",
            "dataType": "TIMESTAMP_NTZ",
            "description": "Warehouse update timestamp"
          }
        ],
        "modelRole": "transaction-fact"
      }
    ],
    "relationships": [
      {
        "fromModel": "fct_sale",
        "fromColumn": "amount",
        "toModel": "dim_location",
        "toColumn": "location_idn",
        "cardinality": "many-to-one"
      },
      {
        "fromModel": "dim_work_lot",
        "fromColumn": "work_lot_id",
        "toModel": "fct_sale",
        "toColumn": "amount",
        "cardinality": "many-to-one"
      },
      {
        "fromModel": "fct_sale",
        "fromColumn": "sale_id",
        "toModel": "dim_project",
        "toColumn": "project_id",
        "cardinality": "many-to-one"
      }
    ]
  },
  "viewConfig": {
    "positions": {
      "dim_project": {
        "x": 609,
        "y": 196
      },
      "dim_work_lot": {
        "x": -40,
        "y": 20
      },
      "dim_contractor": {
        "x": 476,
        "y": 296
      },
      "dim_location": {
        "x": 609,
        "y": 12
      },
      "fct_sale": {
        "x": 292,
        "y": 30
      }
    }
  }
}
