{
  "schemaVersion": 5,
  "domain": "reporting",
  "layer": "gold",
  "description": "Second diagram sharing two models",
  "logical": { "models": ["fct_order", "dim_customer"], "relationships": [] },
  "viewConfig": { "positions": { "dim_customer": { "x": 0, "y": 260 }, "fct_order": { "x": 420, "y": 260 } } }
}
