{
  "schemaVersion": 5,
  "domain": "orders",
  "layer": "silver",
  "description": "A model file that spells column types data_type (#144)",
  "logical": {
    "models": [
      {
        "name": "fct_order",
        "schema": "silver",
        "description": "Orders, with column types spelled the way dbt's schema.yml spells them",
        "columns": [
          {
            "name": "order_id",
            "dataType": "INT",
            "description": "Order identifier",
            "isPrimaryKey": true
          },
          {
            "name": "customer_id",
            "dataType": "INT",
            "description": "",
            "isForeignKey": true
          },
          {
            "name": "amount",
            "dataType": "DECIMAL(18,2)",
            "description": ""
          },
          {
            "name": "status",
            "dataType": "VARCHAR",
            "description": ""
          },
          {
            "name": "note",
            "dataType": "unknown",
            "description": ""
          },
          {
            "name": "placed_at",
            "dataType": "unknown",
            "description": "No type at all"
          }
        ]
      },
      {
        "name": "dim_customer",
        "schema": "silver",
        "description": "Customers, spelled the ERD Studio way",
        "columns": [
          {
            "name": "customer_id",
            "dataType": "INT",
            "description": "",
            "isPrimaryKey": true
          },
          {
            "name": "customer_name",
            "dataType": "VARCHAR",
            "description": ""
          }
        ]
      }
    ],
    "relationships": [
      {
        "fromModel": "fct_order",
        "fromColumn": "customer_id",
        "toModel": "dim_customer",
        "toColumn": "customer_id",
        "cardinality": "many-to-one"
      }
    ]
  },
  "viewConfig": {
    "positions": {
      "fct_order": {
        "x": 0,
        "y": 0
      },
      "dim_customer": {
        "x": 400,
        "y": 0
      }
    }
  }
}
