{
  "schemaVersion": 5,
  "domain": "showcase",
  "layer": "silver",
  "description": "Project task management \u2014 tracks projects, tasks, events, and customers",
  "modelFolder": "models/silver",
  "logical": {
    "models": [
      "fct_task_event",
      "dim_task",
      "dim_project",
      "dim_customer",
      "dim_date",
      "fct_order"
    ],
    "relationships": [
      {
        "fromModel": "fct_task_event",
        "fromColumn": "task_key",
        "toModel": "dim_task",
        "toColumn": "task_key",
        "cardinality": "many-to-one"
      },
      {
        "fromModel": "dim_task",
        "fromColumn": "project_key",
        "toModel": "dim_project",
        "toColumn": "project_key",
        "cardinality": "many-to-one"
      },
      {
        "fromModel": "fct_task_event",
        "fromColumn": "project_key",
        "toModel": "dim_project",
        "toColumn": "project_key",
        "cardinality": "many-to-one"
      },
      {
        "fromModel": "dim_project",
        "fromColumn": "parent_project_key",
        "toModel": "dim_project",
        "toColumn": "project_key",
        "cardinality": "many-to-one"
      },
      {
        "fromModel": "fct_order",
        "fromColumn": "project_key",
        "toModel": "dim_project",
        "toColumn": "project_key",
        "cardinality": "many-to-one"
      },
      {
        "fromModel": "fct_task_event",
        "fromColumn": "customer_key",
        "toModel": "dim_customer",
        "toColumn": "customer_key",
        "cardinality": "many-to-one"
      },
      {
        "fromModel": "fct_order",
        "fromColumn": "customer_key",
        "toModel": "dim_customer",
        "toColumn": "customer_key",
        "cardinality": "many-to-one"
      }
    ]
  },
  "viewConfig": {
    "positions": {
      "dim_customer": {
        "x": 40,
        "y": 60
      },
      "dim_project": {
        "x": 980,
        "y": 60
      },
      "dim_task": {
        "x": 1026,
        "y": 586
      },
      "fct_task_event": {
        "x": 438,
        "y": 544
      }
    },
    "annotations": []
  }
}
